{
  "$schema": "./schemas/design-resource-graph.schema.json",
  "version": "3.3.0",
  "description": "Canonical Orchestra V3 Capability-to-Resource Execution Graph mapping task archetypes across Discovery, Synthesis, Implementation, and QA phases.",
  "domains": {
    "visual_research": [
      "awwwards",
      "godly-design",
      "refero-design",
      "jiro-design",
      "cari-institute",
      "awesome-design-md",
      "land-book",
      "siteinspire",
      "ux-planet",
      "archives-design",
      "letterform-archive"
    ],
    "art_reference": [
      "curationist",
      "rijksmuseum-archive",
      "nypl-digital-collections"
    ],
    "icon_system": [
      "hugeicons",
      "thesvg",
      "morphicons",
      "keyline-icons"
    ],
    "motion_optional": [
      "transitions-dev",
      "its-hover",
      "moving-icons",
      "animate-icons",
      "animemaster"
    ],
    "webgl_optional": [
      "liquid-logo",
      "liquid-glass",
      "vgpu-shaders",
      "scroll-world",
      "vanta"
    ],
    "editorial_research": [
      "peter-oravec",
      "noth-in",
      "united-carriers",
      "k95-studio",
      "awesome-design-md"
    ],
    "hud_research": [
      "k95-studio",
      "noth-in",
      "united-carriers",
      "awesome-design-md"
    ],
    "saas_research": [
      "refero-design",
      "awesome-design-md"
    ],
    "webgl_research": [
      "shaders-com",
      "lax-space",
      "pryzm-design",
      "awwwards"
    ],
    "physics_research": [
      "shaders-com",
      "pryzm-design"
    ],
    "interaction_research": [
      "godly-design",
      "refero-design",
      "jiro-design",
      "uiverse"
    ],
    "reverse_engineering": [
      "skillui",
      "screenshot-to-code",
      "getlayers",
      "firecrawl",
      "scrapling"
    ],
    "paid_kits": [
      "getlayers"
    ],
    "interaction_components": [
      "shadcn-ui",
      "react-bits",
      "kokonut-ui",
      "cult-ui",
      "hyperui",
      "magic-ui-oss",
      "motion-primitives"
    ],
    "diagrams": [
      "diagram-generator",
      "pretty-mermaid"
    ],
    "backend_optional": [
      "supabase",
      "postgres-best-practices"
    ],
    "design_audit": [
      "hallmark",
      "unlazy",
      "react-best-practices",
      "skill-security-check"
    ],
    "design_synthesis": [
      "taste-design",
      "impeccable",
      "emil-design-eng",
      "no-ai-slop"
    ],
    "typography_protocol": [
      "apple-hig-typography",
      "material-3-typography",
      "mdn-css-fonts",
      "not-your-type",
      "geist-font",
      "geist-mono-font"
    ],
    "motion": [
      "gsap",
      "lenis",
      "motion-dev",
      "react-spring",
      "react-bits"
    ],
    "motion_physics": [
      "react-bits",
      "react-spring",
      "motion-dev"
    ],
    "webgl": [
      "r3f",
      "drei",
      "shadergradient",
      "threeui",
      "shaders-com"
    ],
    "physics_engine": [
      "trig-js",
      "react-spring",
      "r3f",
      "shadergradient"
    ],
    "editorial_engine": [
      "pretext",
      "lenis"
    ],
    "hud_primitives": [
      "pretext",
      "react-bits",
      "motion-dev",
      "expo-haptics"
    ],
    "b2b_components": [
      "shadcn-ui",
      "motion-dev"
    ],
    "sensory": [
      "expo-haptics",
      "apple-playing-haptics",
      "android-vibration-effect",
      "elevenlabs"
    ],
    "security": [
      "ship-safe",
      "strix",
      "semgrep"
    ],
    "qa": [
      "playwright",
      "lighthouse",
      "impeccable",
      "no-ai-slop"
    ],
    "academic_docs": [
      "orchestra-docs"
    ],
    "repo_intelligence": [
      "serena",
      "codebase-memory-mcp"
    ],
    "research_crawler": [
      "scrapling",
      "firecrawl",
      "crawl4ai"
    ],
    "optional_harness": [
      "jcode"
    ]
  },
  "capabilities": {
    "premium-website": {
      "name": "Premium Creative Website",
      "description": "Award-winning editorial or agency landing page with sophisticated typography, curated motion, and high aesthetic density.",
      "primary_archetype": "creative_showcase",
      "trigger_tags": [
        "premium",
        "landing-page",
        "agency",
        "award-winning",
        "portfolio-hero",
        "high-aesthetic",
        "portfolio",
        "shop",
        "storefront",
        "ecommerce",
        "checkout",
        "marketing-site"
      ],
      "discovery": [
        "visual_research"
      ],
      "reverse_engineering": [
        "skillui"
      ],
      "synthesis": [
        "design_synthesis",
        "typography_protocol"
      ],
      "implementation": [
        "motion"
      ],
      "optional_extensions": [
        "webgl",
        "icon_system",
        "motion_optional",
        "paid_kits"
      ],
      "qa": [
        "playwright",
        "lighthouse",
        "impeccable"
      ],
      "anti_patterns": [
        "Inter or Space Grotesk in creative headlines",
        "Generic 3-column equal card layouts",
        "Neon purple AI gradient backgrounds",
        "Pure black #000000 surfaces without chromatic depth"
      ],
      "quality_bar": "PREMIUM",
      "risk_rank": 6,
      "platform": "web",
      "trigger_conditions": [
        "A stranger, client, or recruiter is the audience",
        "The brief names a brand, studio, agency, restaurant, or launch page",
        "Marketing or conversion copy is the primary content",
        "The request asks for a distinctive look rather than a working form",
        "A showcase carries commerce alongside the story — a shop or checkout bolted onto a brand page"
      ],
      "skip_conditions": [
        "The surface is behind a login and only staff will see it",
        "The request is a bugfix, refactor, or backend change",
        "The product is a dense data tool — route to saas-dashboard or b2b-portal",
        "The human said \"skip the lab\" and only wants the page wired up",
        "A 3D scene is the point rather than the decoration — route to 3d-portfolio"
      ]
    },
    "3d-portfolio": {
      "name": "Interactive 3D WebGL Portfolio",
      "description": "Spatial WebGL digital showcase featuring Three.js/R3F scenes, custom shaders, and interactive camera orbits.",
      "primary_archetype": "spatial_experience",
      "trigger_tags": [
        "3d",
        "portfolio",
        "webgl",
        "threejs",
        "r3f",
        "spatial-ui",
        "shader"
      ],
      "discovery": [
        "visual_research",
        "webgl_research"
      ],
      "synthesis": [
        "design_synthesis"
      ],
      "implementation": [
        "webgl",
        "motion"
      ],
      "optional_extensions": [
        "sensory",
        "webgl_optional",
        "paid_kits"
      ],
      "qa": [
        "playwright",
        "lighthouse"
      ],
      "anti_patterns": [
        "Uncapped framerate animation loops causing CPU thermal throttling",
        "Missing mobile fallback for low-end WebGL GPUs",
        "Blocking main thread during 3D asset initialization"
      ],
      "quality_bar": "EXPERIMENTAL",
      "risk_rank": 8,
      "platform": "web",
      "trigger_conditions": [
        "The brief names WebGL, Three.js, R3F, shaders, or a 3D scene",
        "Camera movement or spatial navigation is part of the concept",
        "The showcase itself is the product, not a page describing a product"
      ],
      "skip_conditions": [
        "No low-end or reduced-motion fallback is acceptable to the human",
        "3D is decorative and a flat hero would carry the same message",
        "The target is a low-power device or an audience on poor connections",
        "The brief is a portfolio but never mentions depth, scene, or motion — route to premium-website",
        "Physics simulation is the point rather than presentation — route to physics-canvas"
      ]
    },
    "operator-hud": {
      "name": "Operator HUD & Mission Control",
      "description": "High-density telemetry dashboard, AI cockpit, and operator control room inspired by Lyra (dark crimson, monospace figures, zero generic cards).",
      "primary_archetype": "mission_control",
      "trigger_tags": [
        "operator-hud",
        "hud",
        "mission-control",
        "telemetry",
        "dark-crimson",
        "terminal-ui",
        "cockpit",
        "monitoring",
        "uptime",
        "observability",
        "status-board",
        "incident"
      ],
      "discovery": [
        "hud_research"
      ],
      "synthesis": [
        "design_synthesis",
        "typography_protocol"
      ],
      "implementation": [
        "hud_primitives",
        "motion_physics"
      ],
      "optional_extensions": [
        "sensory",
        "security"
      ],
      "qa": [
        "playwright",
        "semgrep"
      ],
      "anti_patterns": [
        "Generic shadcn card layouts or template UI kits",
        "Light mode or pure white background panels",
        "Floating decorative gradients without data utility",
        "Proportional fonts on live fluctuating data values"
      ],
      "quality_bar": "PREMIUM",
      "risk_rank": 7,
      "platform": "web",
      "trigger_conditions": [
        "A single operator monitors live state and acts on it",
        "The brief names telemetry, cockpit, mission control, or a command surface",
        "Information density matters more than whitespace",
        "Monospace figures and always-on status are expected",
        "The brief describes watching servers, jobs, or streams while they run"
      ],
      "skip_conditions": [
        "The audience is many casual users rather than one trained operator",
        "The data is reported after the fact — route to saas-dashboard",
        "The brief expects a component kit look; this route is bespoke by definition",
        "Administrative CRUD is the real job — route to b2b-portal"
      ]
    },
    "b2b-portal": {